tweet_id,created_at,text
1356342652669743107,2021-02-01 20:44:22,"RT @Francetele: #Culturebox : c'est parti ! Place au spectacle vivant, aux artistes, à l'émotion, et au live : @ftvculturebox, le spectacle…"
1356331866249453572,2021-02-01 20:01:30,"Pour soutenir la montagne, nos vallées, celles et ceux qui y vivent, il fallait une réponse immédiate et puissante… https://t.co/L2X625tiBu"
1356331859286831109,2021-02-01 20:01:29,Les salariés et saisonniers en activité partielle pourront bénéficier d'une prise en charge intégrale de leurs frai… https://t.co/qVU6bBgV0E
1356331852227698692,2021-02-01 20:01:27,"Les secteurs les plus touchés comme l'hôtellerie, la restauration ou l'hébergement pourront bénéficier de la couver… https://t.co/tSw00AO4l8"
1356331846540394496,2021-02-01 20:01:26,"Pour nos entreprises situées dans les stations et vallées, nous élargirons l'accès au fonds de solidarité aux établ… https://t.co/2XDBhGcxJu"
1356331841054191620,2021-02-01 20:01:24,"La situation sanitaire ne permet pas la réouverture des remontées mécaniques de nos domaines skiables.
Au-delà des… https://t.co/1Wefps0mGF"
1356152971059470338,2021-02-01 08:10:39,RT @gouvernementFR: EN DIRECT | Ouverture du Beauvau de la sécurité par le Premier ministre @JeanCastex https://t.co/I68CHWZsKG
1355959265442344960,2021-01-31 19:20:56,"Plus que jamais, le rôle de l'État est d’être aux côtés de ceux qui souffrent, de ceux qui se sentent exclus, de ce… https://t.co/3dBAatPg8K"
1355564015863406594,2021-01-30 17:10:21,RT @EmmanuelMacron: J’ai confiance en nous. Les heures que nous vivons sont cruciales. Faisons tout pour freiner l’épidémie ensemble.
1355254297571823619,2021-01-29 20:39:38,Les prochains jours seront déterminants. https://t.co/unHP1AVgKJ
1355250318444007430,2021-01-29 20:23:49,Nous pouvons encore nous donner une chance d'éviter le confinement.
1355249541327560704,2021-01-29 20:20:44,"Le « quoi qu'il en coûte » - prêts garantis par l'État, fonds de solidarité, chômage partiel - s'appliquera bien sû… https://t.co/qC4tBB2g2D"
1355249118822719494,2021-01-29 20:19:03,"À compter de ce dimanche, les centres commerciaux non alimentaires d’une surface supérieure à 20 000 mètres carrés,… https://t.co/fXFp715uCj"
1355244444136730624,2021-01-29 20:00:29,"Les dérives de quelques uns ne sauraient ruiner les efforts de tous.
Les policiers et les gendarmes seront mobilisé… https://t.co/vGM5VCFjNz"
1355242559593979904,2021-01-29 19:53:00,Toute entrée en France et toute sortie de notre territoire à destination ou en provenance d'un pays extérieur à l'U… https://t.co/G0osA8pWfg
1355238595930574850,2021-01-29 19:37:15,"RT @Elysee: EN DIRECT | Déclaration du Premier ministre @JeanCastex à l’issue du Conseil de défense Covid-19.
https://t.co/7jT17kXsO5"
1355198895006117889,2021-01-29 16:59:29,"De Varennes-sur-Allier à Grigny.
#FranceRelance, c'est un cercle vertueux : l'accélération du plan très haut débit… https://t.co/KdbVyOds5K"
1355191084691951618,2021-01-29 16:28:27,"RT @Elisabeth_Borne: A Grigny pour le Comité interministériel des villes, nous lançons une mobilisation générale pour les habitants des qua…"
1355177721010270211,2021-01-29 15:35:21,"RT @jmblanquer: En avant pour l’égalité des chances!

A Grigny avec @JeanCASTEX pour le comité interministériel à la ville.
L'École de la R…"
1355155518961147904,2021-01-29 14:07:07,"RT @NadiaHAI78: #CIV | 2 Mds€ supplémentaires pr le renouvellement urbain, bientôt 200 Cités Éducatives et 200 Cités de l’emploi, 600 M€ pr…"
1355150458520805377,2021-01-29 13:47:01,"Accompagner individuellement chaque enfant, chaque jeune dans son parcours, depuis la petite enfance jusqu’à l’inse… https://t.co/xQ6SIzsMxd"
1355150451637972994,2021-01-29 13:46:59,5% des enfants issus de milieux populaires ont accès à une place en crèche contre 20% des enfants issus de classes… https://t.co/e2d8cVdoRK
1355139242817630217,2021-01-29 13:02:27,"À Grigny, j'ai rencontré des femmes et des hommes profondément attachés à leur quartier mais qui souffrent quotidie… https://t.co/sS0kEQ2dLF"
1355131443043840000,2021-01-29 12:31:27,"Engagement tenu !
Un État efficace et présent, c’est d’abord un État qui tient parole.
Je viens de confirmer à Grig… https://t.co/zZ8ADDcpM7"
1355113912346279942,2021-01-29 11:21:48,RT @gouvernementFR: EN DIRECT | Le Premier ministre @JeanCastex conclut depuis Grigny le comité interministériel des Villes. https://t.co/C…
1355110433502461954,2021-01-29 11:07:58,"26% des habitants de nos quartiers se sentent en insécurité, contre 10 % au plan national.
S'y résoudre, c'est acce… https://t.co/ZsBrRw36XL"
1354790726148763649,2021-01-28 13:57:34,"RT @pole_emploi: Ce matin, un drame s’est produit dans l’agence Pôle emploi Valence Hugo.
Une de nos collègues, responsable d’équipe, est d…"
1354738631957749762,2021-01-28 10:30:34,"RT @Elisabeth_Borne: Très émue par le drame qui s’est déroulé ce matin à Valence, toutes mes pensées vont aux proches des victimes et aux a…"
1354735729860108290,2021-01-28 10:19:02,"En intervenant avec professionalisme, sang froid et courage, nos policiers ont à nouveau fait honneur à leur unifor… https://t.co/mwLlTdXKNr"
1354735728631099392,2021-01-28 10:19:02,"La drame survenu à Valence endeuille le pays tout entier.
Aux familles et aux proches des victimes, j'adresse mon s… https://t.co/cj59AEpHeF"
1353787185854619658,2021-01-25 19:29:51,RT @EmmanuelMacron: Investors: #ChooseFrance! https://t.co/IhcHZkwIxc
1353736551835049985,2021-01-25 16:08:39,RT @aur_rousseau: Visite inaugurale de @jeancastex et @olivierveran au nouveau siège de l’@ARS_IDF. Heureux de présenter le travail des équ…
1353716843756843019,2021-01-25 14:50:21,"Souvent dans l'ombre mais toujours en première ligne.
Tracing, dépistage des publics fragiles, suivi épidémiologiqu… https://t.co/9RlykmNDgL"
1353408792650805250,2021-01-24 18:26:15,"La reconquête de notre souveraineté économique et de notre compétitivité commence ici, sur nos côtes. https://t.co/6AdvyQRGza"
1353070464717922307,2021-01-23 20:01:52,"Dans cette période où les doutes se transforment souvent en angoisses, où l'isolement mure parfois nos étudiants da… https://t.co/Z25ugy2Mo2"
1353070461542780939,2021-01-23 20:01:51,"Oui, rien ne peut complètement remplacer un cours en présentiel : ces étudiants strasbourgeois me l'ont redit.
Ils… https://t.co/Ieu2Mn29Iz"
1353070449853231104,2021-01-23 20:01:48,"Nous y répondons : 2 repas par jour à 1€ pour tous, dans tous les restos U.
Ici, l'annonce d'@EmmanuelMacron a été… https://t.co/exP5cHL3hp"
1353070446468456450,2021-01-23 20:01:47,"À Strasbourg, j'ai vu l'engagement exemplaire de l'@AFGES, du @CrouStrasbourg et de l'@Unistra au service des étudi… https://t.co/hrFEf7PGAG"
1353070440311181319,2021-01-23 20:01:46,"S'épanouir dans sa vie et dans ses cours, sortir, s'ouvrir aux autres, s'ouvrir au monde : être étudiant, c'est tou… https://t.co/QSzUt8oA3C"
1353069595339354113,2021-01-23 19:58:25,"RT @EmmanuelMacron: Des vies brisées dans le sanctuaire d'une chambre d’enfant. Des enfances volées lors de vacances en famille, ou de mome…"
1353004096710733824,2021-01-23 15:38:08,1 million de Français vaccinés. https://t.co/domYssnqcj
1352973341838213120,2021-01-23 13:35:56,"L’affirmation et la consolidation du statut de capitale européenne de Strasbourg, en plus d’être un symbole de la r… https://t.co/UxKV3ujg2p"
1352931800050491398,2021-01-23 10:50:52,"La collectivité européenne d’Alsace est née le 1er janvier.
En acceptant de donner à ce profond « désir d’Alsace »… https://t.co/hhyVO4szVy"
1352926695809052672,2021-01-23 10:30:35,"Le désir de retrouver @ToutelAlsace ne constitue ni une lubie folklorique, ni une menace à l’unité de la République… https://t.co/7lK5Azntqh"
1352903328884289536,2021-01-23 08:57:43,RT @gouvernementFR: EN DIRECT | Intervention de @JeanCastex devant les élus de la collectivité européenne d’Alsace. https://t.co/bWz7jfqsBB
1352668356286033922,2021-01-22 17:24:02,L’accord obtenu avec les autorités britanniques a permis de maintenir l’accès de nos pêcheurs à toutes les eaux bri… https://t.co/BXQhmowDhc
1352639225225687044,2021-01-22 15:28:16,"Aucun pays ne peut avoir d’ambition maritime sans une ambition portuaire. 
En juin, les ports du Havre, de Rouen et… https://t.co/e3jy5NslaP"
1352637049573171200,2021-01-22 15:19:38,"RT @EPhilippe_LH: Au Havre, avec @JeanCASTEX . Avec HAROPA, c’est désormais de la puissance des ports du Havre, de Rouen et de Paris qu’il…"
1352629757209407488,2021-01-22 14:50:39,"RT @AnnickGirardin: Le #CIMer est un point d'étape important pour la politique maritime française. Depuis sa fondation en juillet 2020, le…"
1352600007891939328,2021-01-22 12:52:26,"Le récent engouement suscité par la pêche durable est encourageant !
Avec le #CIMer, le Gouvernement s'engage à ren… https://t.co/ujVHXjGEtu"
1352587952275206144,2021-01-22 12:04:32,"L’éolien marin est un atout majeur pour atteindre la neutralité climatique.
Le parc qui est amené à voir le jour en… https://t.co/Z2Wu01JVlm"
1352581655689625600,2021-01-22 11:39:31,RT @gouvernementFR: EN DIRECT | #CIMer : @JeanCastex conclut depuis Le Havre le comité interministériel de la mer. https://t.co/K8q4me679q
1352559494337855488,2021-01-22 10:11:27,"Aussi haut qu'un immeuble de 26 étages, plus long que 4 terrains de football, le @CMACGM Jacques Saadé est le plus… https://t.co/3bcn1T2Z4b"
1352547539317354497,2021-01-22 09:23:57,"« Une mer calme n’a jamais fait un bon marin » : si j’en crois l’adage des gens d’à bord, je retrouve aujourd’hui u… https://t.co/RRGZldDJlu"
1352322552383737857,2021-01-21 18:29:56,"RT @Elysee: Étudiants, vous n'êtes pas oubliés.
Que vous soyez boursier ou non boursier, vous aurez droit à 2 repas par jour à 1€ dans tous…"
1351639301151461379,2021-01-19 21:14:56,"RT @EmmanuelMacron: Pour nous protéger, l’engagement de nos armées est exceptionnel :"
1351574494457028608,2021-01-19 16:57:25,"Immuniser les personnes les plus vulnérables, c'est une priorité sanitaire mais aussi éthique.
La semaine qui s'ouv… https://t.co/RjJSebeca2"
1351260417155358730,2021-01-18 20:09:23,"J'en profite pour rappeler à chacune et chacun d'entre vous qu'avec le 100% santé, les lunettes de vue sont désorma… https://t.co/eZS6YSnwoq"
1351250342634254341,2021-01-18 19:29:21,Privilégier des considérations économiques à des considérations sanitaires : pas question. https://t.co/NtD7msQKAN
1351241229078573059,2021-01-18 18:53:08,"Depuis septembre, la France est le pays d'Europe qui a le plus maintenu la scolarité de ses élèves dans le primaire… https://t.co/HnRLq8dCNd"
1351238649308975104,2021-01-18 18:42:53,Le débat sur l’instauration d’un passeport vaccinal est prématuré. https://t.co/Nx0Q0YYI2P
1351234852750843904,2021-01-18 18:27:48,"20 000 de nos compatriotes sont décédés des suites de la #COVID19 dans les EHPAD.
C'est un public vulnérable qu'il… https://t.co/BXS8gvGONR"
1351231869581451265,2021-01-18 18:15:57,"Mon seul souci, ma seule boussole, c’est de prendre les bonnes décisions au bon moment. https://t.co/0SoJyLNjj7"
1350895581955301378,2021-01-17 19:59:39,"Tous les efforts que l'État mène dans le cadre de #FranceRelance n'étaient pas inscrits dans l'accord signé hier.
D… https://t.co/S7iXigautm"
1350895577261858816,2021-01-17 19:59:38,"Avec +31% de contrats d'apprentissage signés en Auvergne-Rhône-Alpes en 2020, le plan #1jeune1solution porte déjà s… https://t.co/kz7ahcPxcc"
1350895575693193219,2021-01-17 19:59:38,La @ViaRhona permet de relier les Alpes du nord à la Méditerranée en empruntant une piste cyclable qui épouse le co… https://t.co/tb0Z2MfZ6O
1350895569913475072,2021-01-17 19:59:36,"Habiter une région, c'est partager plus qu'un territoire : des paysages, des traditions, un patrimoine.
15 projets… https://t.co/SIoHnSLFVa"
1350895559327043586,2021-01-17 19:59:34,"Le @CrousGrenoble, la préfecture de Valence, l'@UnivLyon1, le service central de la police technique et scientifiqu… https://t.co/3LdpJn54Jg"
1350895485142360066,2021-01-17 19:59:16,On les appelle les « petites lignes » mais elles suscitent partout de grandes attentes pour nos concitoyens : les t… https://t.co/vT7iL3CL53
1350895482093056001,2021-01-17 19:59:16,"Vous habitez la région Auvergne-Rhône-Alpes ?
Voici quelques-uns des projets qui verront le jour grâce à l'accord… https://t.co/3xag9OVm5q"
1350522002466091009,2021-01-16 19:15:11,"Partout, je rechercherai le rassemblement et l'unité.
Avec #FranceRelance, nous travaillons avec tous et pour tous. https://t.co/dbHMIofs4H"
1350458650133934083,2021-01-16 15:03:27,RT @gouvernementFR: EN DIRECT | #FranceRelance : État et région @auvergnerhalpes unissent leurs forces pour la relance et l’emploi. https:/…
1350436931868491777,2021-01-16 13:37:09,On le sait et je l’ai encore vu dans l’Allier : la fibre donne accès au très haut débit mais elle apporte aussi ave… https://t.co/nSFlOOnfdH
1350432203948363776,2021-01-16 13:18:21,On ne peut accepter que des territoires n’aient pas accès à la télémédecine (ou simplement au télétravail) faute d’… https://t.co/9yZY9wUHga
1350415936579375104,2021-01-16 12:13:43,"RT @cedric_o: Ce matin, avec @JeanCASTEX à Varennes-sur-Allier, nous avons annoncé 570M€ supplémentaires pour déployer la fibre sur l’ensem…"
1350406658002984960,2021-01-16 11:36:51,"La fibre arrive à Varennes-sur-Allier : avec 2/3 de son territoire couvert en très haut débit, la France est devenu… https://t.co/gJUEWE5pK7"
1350172903984295936,2021-01-15 20:07:59,"De la prise de rendez-vous à la première injection, c'est toute une chaîne humaine qui est mobilisée pour immuniser… https://t.co/vyeGw8bKo2"
1349807316451946499,2021-01-14 19:55:17,RT @CBeaune: La règle s’applique aux voyageurs en provenance du Royaume-Uni 🇬🇧 @francediplo @FranceintheUK
1349794937521496070,2021-01-14 19:06:05,"La priorité des priorités pour sortir de cette crise, c’est le recours à la vaccination.
Nous mettrons toutes nos f… https://t.co/LNhQeHdKHB"
1349786433712746498,2021-01-14 18:32:18,"J’entends encore des commentateurs s’étonner que nous ne vaccinions pas tout de suite tout le monde, quel que soit… https://t.co/uEEkc41owE"
1349770503825874946,2021-01-14 17:29:00,"Dans les 15 premiers départements où le couvre-feu a été mis en œuvre à 18h00 dès le 2 janvier dernier, la hausse d… https://t.co/jyUbE0DRBN"
1349769104429887488,2021-01-14 17:23:26,"RT @olivierveran: Le variant dit variant britannique serait responsable d’1,4% des cas de #COVID19 actuellement diagnostiqués en 🇫🇷.
Limita…"
1349767059043995652,2021-01-14 17:15:18,"Sur l’ensemble du territoire métropolitain, le couvre-feu s’appliquera à compter de 18h00 à partir de ce samedi et… https://t.co/n9zF4bgIjg"
1349766553017978880,2021-01-14 17:13:18,Les personnes concernées devront également s'engager sur l'honneur à s’isoler pendant 7 jours une fois arrivées en… https://t.co/VWd6QYAIvA
1349766318518657026,2021-01-14 17:12:22,"À compter de lundi, tous les voyageurs qui souhaitent venir en France, en provenance d’un pays extérieur à l’Union… https://t.co/bthBMxinNf"
1349763708491333635,2021-01-14 17:02:00,RT @gouvernementFR: EN DIRECT | #COVID19: conférence de presse du Premier ministre @JeanCastex. https://t.co/IwUGgBRKhL
1349669378187530240,2021-01-14 10:47:10,"Immuniser les plus vulnérables et protéger ceux qui nous protègent : à Metz, comme partout dans le pays, la premièr… https://t.co/ybSxmGUroW"
1349637416349523969,2021-01-14 08:40:09,RT @gouvernementFR: EN DIRECT | Vaccination contre la #COVID19: @JeanCastex s’exprime depuis le centre hospitalier régional de Metz-Thionvi…
1349471876087746560,2021-01-13 21:42:21,C’est de la loyauté à ses engagements que Marielle de Sarnez puisait sa force pour moderniser notre démocratie et d… https://t.co/WoXkwfoHtF
1349409946367107073,2021-01-13 17:36:16,"RT @gouvernementFR: Grâce au #BaromètreDesRésultats présenté par @ADeMontchalin, vous pouvez suivre la mise en œuvre des politiques du Gouv…"
1349394110650716162,2021-01-13 16:33:21,"Et ils seront bientôt des millions.
500€ pour permettre aux jeunes de découvrir la culture près de chez eux et un o… https://t.co/1O22eVTIIy"
1349394109119803396,2021-01-13 16:33:20,"Plus d'effectifs et plus de moyens, ce sont des priorités de la #PoliceSécuritéQuotidien.
Comme ici dans le Val-d'O… https://t.co/evjSXAIQ6H"
1349394107588878339,2021-01-13 16:33:20,"Voir, entendre et sourire ne doivent plus être un luxe : lunettes, soins dentaires et auditifs sont désormais 100%… https://t.co/AxFa5WBhI1"
1349394106020208641,2021-01-13 16:33:20,"Objectif : 2000 maisons de santé pluri-professionnelles en 2022.
Comme à Levet, nous devons concilier santé et prox… https://t.co/k52RfIW9ig"
1349394104476704771,2021-01-13 16:33:19,"Comme Carla, des centaines de milliers de jeunes ont fait le choix de l'alternance.
Le plan #1jeune1solution a perm… https://t.co/KYNRRz7aWW"
1349394102912217090,2021-01-13 16:33:19,"La taxe d'habitation a été supprimée pour 80% des Français. En 2023, l'ensemble des foyers en seront exonérés.
→ Re… https://t.co/7lFTKijDBJ"
1349394101347737613,2021-01-13 16:33:18,"Il n'y a pas d'âge pour faire du vélo : avec le #PlanVélo, nous allons tripler la part du vélo dans les déplacement… https://t.co/R5sBlPEqPT"
1349394099862982661,2021-01-13 16:33:18,"Une réforme est réussie lorsqu'elle change nos vies.
Avec le #BaromètreDesRésultats présenté par @AdeMontchalin, on… https://t.co/dpr6hFhUJi"
1349386282225512448,2021-01-13 16:02:14,"Non, la France n’a pas à rougir de sa stratégie de lutte contre la #COVID19 ! https://t.co/c7qTdt7AGb"
1349376159528718336,2021-01-13 15:22:01,RT @AdeMontchalin: Le @gouvernementFR n'a rien cédé face à la crise sanitaire. 2020 n'aura pas été une année blanche. Les résultats de nos…
1349357319977631744,2021-01-13 14:07:09,"RT @Elysee: EN DIRECT | Compte rendu du Conseil des ministres et du séminaire gouvernemental du 13 janvier 2021 par @GabrielAttal, porte-pa…"
1349026556606361601,2021-01-12 16:12:49,"Nous n'ignorons rien de la solitude, des difficultés psychologiques et du retard pédagogique des étudiants.
Avec… https://t.co/A63SCb3Hw1"
1348725831175188483,2021-01-11 20:17:50,"RT @EmmanuelMacron: Je comprends l’impatience de celles et ceux qui, engagés pour la planète, ont le sentiment que nous n’allons pas suffis…"
1348692752356274176,2021-01-11 18:06:24,"Ainsi que l’a rappelé @Francois_Molins, « la Justice n’est pas la seule affaire des juges et des procureurs, elle e… https://t.co/Ab5CIQe8M4"
1348570560947773441,2021-01-11 10:00:51,"Pendant 40 ans, nous avions appris à lever l'ancre avec lui.
Plus qu'un moment de télévision, Georges Pernoud a par… https://t.co/qBB9Lx9tZb"
1348346227021254656,2021-01-10 19:09:26,"« Quand pourrons-nous revivre normalement ? » : cette question revient lors de mes déplacements, et ici même.
Je ne… https://t.co/fT4o67GLOg"
1347969672143130627,2021-01-09 18:13:08,"Inscrite au patrimoine mondial par l'UNESCO, la collégiale Saint-Pierre de La Romieu sera rénovée grâce au contrat… https://t.co/VOJ6rmZQrf"
1347969665147031558,2021-01-09 18:13:06,Un centre de préparation à la haute performance verra le jour au centre national d'entrainement en altitude de Font… https://t.co/mwIgBlmBX6
1347969662341029891,2021-01-09 18:13:06,"À Mur-de-Barrez, citée médiévale de 800 habitants située entre Rodez et Aurillac, #FranceRelance participera à la c… https://t.co/JXbiroTF3F"
1347969656515080198,2021-01-09 18:13:04,"La croissance verte est au cœur de la stratégie de #FranceRelance : en Occitanie, nous soutiendrons Hydromer et Hyd… https://t.co/2QyOXTSlre"
1347969654006931457,2021-01-09 18:13:04,Le plan #1jeune1solution porte ses fruits : les aides à l'embauche des jeunes et à l'alternance ont permis aux entr… https://t.co/djN9KDvGN2
1347969652320821255,2021-01-09 18:13:03,"Créée en 2007 à Albi, la société Aurock, spécialisée dans les pièces destinées à l'aéronautique, va bénéficier du s… https://t.co/4MfTk4EYxk"
1347969648243970052,2021-01-09 18:13:02,"Comme je l'ai fait il y a quelques jours avec la région Sud, j'ai souhaité partager avec vous quelques exemples con… https://t.co/ZBpc1l12Un"
1347907611975421952,2021-01-09 14:06:32,"Ce geste sauve et va sauver des millions de vies.
C'est notre honneur et notre devoir que chaque dose de vaccin soi… https://t.co/bsUq1L88q2"
1347867387152969730,2021-01-09 11:26:41,RT @gouvernementFR: EN DIRECT | #COVID19: @JeanCastex s’exprime depuis le centre de #vaccination de Tarbes. https://t.co/sXHrPqUhB4
1347860158353965058,2021-01-09 10:57:58,"Du concret !
Située à quelques kilomètres de Tarbes, la Société des Céramiques Techniques est désormais mondialemen… https://t.co/4ruqsRlXsL"
1347508925025964032,2021-01-08 11:42:17,"La crise sanitaire ne doit pas être un frein à l’innovation.
Nous avons au contraire plus que jamais besoin d’inves… https://t.co/k6pDersARI"
1347479488632938499,2021-01-08 09:45:19,"RT @gouvernementFR: EN DIRECT | Santé, transports, industrie, éducation, culture : cap sur la France de 2030 avec les investissements d’ave…"
1347474179331944448,2021-01-08 09:24:13,"Les investissements d’aujourd’hui seront les emplois de demain.
Accompagné par @Bpifrance, @ExotrailSpace a triplé… https://t.co/BhuznAsnRn"
1347253433234059264,2021-01-07 18:47:03,"Se faire vacciner, c’est se protéger soi-même mais c’est aussi protéger les autres. Montrons que nous sommes une na… https://t.co/jNEhMVO149"
1347251320516980737,2021-01-07 18:38:40,"RT @olivierveran: À partir de jeudi 14, les personnes de 75 ans et plus pourront prendre RDV sur internet ou par téléphone en vue de se fai…"
1347239052035182593,2021-01-07 17:49:55,"On ne peut pas, alors que le match vient de commencer et qu’il durera plusieurs mois, prétendre dès les premières m… https://t.co/s7JkIYEx8G"
1347238416598102022,2021-01-07 17:47:23,"D’ici fin janvier, les quantités reçues et qui arriveront au cours du mois nous permettront d’être en capacité de v… https://t.co/kaOk2yGNce"
1347235798287081472,2021-01-07 17:36:59,"La campagne vaccinale suscite des attentes et des interrogations légitimes.
Elle a aussi donné lieu, ces derniers j… https://t.co/nf6KHztLV8"
1347232830842146816,2021-01-07 17:25:11,"Depuis mai, nous n’avons eu de cesse d’optimiser notre politique de dépistage. 86% des résultats sont rendus en moi… https://t.co/TTtkeFdCNe"
1347230024961822723,2021-01-07 17:14:02,Nous devons retrouver une dynamique de baisse : c’est la condition pour reprendre le contrôle de l’épidémie de… https://t.co/YDCZTt6NNX
1347229635621302274,2021-01-07 17:12:30,Si la circulation de la #COVID19 reste moins active chez nous que dans la plupart de nos voisins européens la situa… https://t.co/w8Y5xYQxpc
1347226950088224768,2021-01-07 17:01:49,RT @gouvernementFR: EN DIRECT | #COVID19: conférence de presse du Premier ministre @JeanCastex. https://t.co/4p0KOnL5c3
1347117000359874563,2021-01-07 09:44:55,https://t.co/bk28ivWasL
1346489547509665799,2021-01-05 16:11:39,Ces quatre sites emblématiques de @MaRegionSud ont un point commun : ils seront tous rénovés grâce à des investisse… https://t.co/FsRHA86wXf
1346489536403148800,2021-01-05 16:11:36,"Investir dans l'avenir, c'est aussi permettre à nos étudiants de suivre leur parcours universitaire dans les meille… https://t.co/wFKjx2EG3A"
1346489534738010114,2021-01-05 16:11:36,"Durement éprouvées par la tempête Alex, les Alpes-Maritimes bénéficieront du soutien de l'État et de la solidarité… https://t.co/KyH5N7REy2"
1346489533135777797,2021-01-05 16:11:35,"Avec #FranceRelance, le port de Toulon va devenir le premier port de Méditerranée dont tous les quais seront électr… https://t.co/1qhCKOaahV"
1346489529012781062,2021-01-05 16:11:34,"Je sais combien les « milliards » peuvent paraitre abstraits mais derrière chaque euro investi par #FranceRelance,… https://t.co/tS2UcK1GfD"
1346411482381234178,2021-01-05 11:01:27,"La transition écologique, le développement économique et le droit à la formation c’est pour tout le monde !… https://t.co/5SGmlxUDWQ"
1346388513231695874,2021-01-05 09:30:10,RT @gouvernementFR: EN DIRECT | #FranceRelance: @JeanCastex signe le premier accord régional de relance à Toulon. https://t.co/KWR0Rywafv
1345638151340089344,2021-01-03 07:48:30,C’est en combattant le terrorisme et l’obscurantisme que le sergent Yvonne Huynh et le brigadier Loïc Risser sont m… https://t.co/rYZkJdu7Au
1345008033022308352,2021-01-01 14:04:38,"Faya-Largeau c’est l’histoire et l’honneur.
L’histoire de ceux qui, partis du cœur de l’Afrique, libéreront notre p… https://t.co/c0a5iPl7a0"
1344749568999743488,2020-12-31 20:57:36,"À nos soldats, morts pour que nous vivions libres. https://t.co/mho3Q5O6Pl"
1344728989617844225,2020-12-31 19:35:49,RT @gouvernementFR: EN DIRECT | Le Premier ministre @JeanCastex rend hommage depuis N’Djamena aux soldats morts en opération. https://t.co/…
1344720147840442369,2020-12-31 19:00:41,"RT @EmmanuelMacron: Vœux 2021 aux Français.
https://t.co/ycdR7K8g0v"
1344712743467802625,2020-12-31 18:31:16,"Camp Kosseï, N’Djamena.
Ici, des femmes et des hommes nous protègent, au péril de leur vie.
Avec émotion, fierté, e… https://t.co/ZhCsdhdg4z"
