tweet_id,created_at,text
1344698873416183808,2020-12-31 17:36:09,"Première étape de mon déplacement au Tchad, à Amdjarass.
La France sait le rôle déterminant de l’engagement tchadie… https://t.co/zB1L6GXrRW"
1343994872286638082,2020-12-29 18:58:42,"RT @sarahelhairy: L’appel du 31 décembre est fort et cette envie est légitime. Les efforts faits depuis 10 mois, ceux des jeunesses de Fran…"
1343656252036050944,2020-12-28 20:33:09,"Ils ont donné leur vie pour leur patrie.
N’oublions jamais le sacrifice du brigadier-chef Tanerii Mauri et des chas… https://t.co/vDUNrayvr5"
1342166820229423108,2020-12-24 17:54:40,"Derrière chaque produit qui est distribué dans notre pays, il y a souvent toute une chaine logistique, et nos routi… https://t.co/JzRiylaP2k"
1342145108989382662,2020-12-24 16:28:24,"À tous ceux qui la font vivre et l'incarnent, à vous toutes et tous, je souhaite, du fond du cœur, un joyeux Noël e… https://t.co/O5Hqt7n8Tg"
1342145107542290434,2020-12-24 16:28:24,Alors que cette année a rappelé à chacune et chacun d'entre nous combien ces liens sociaux qui nous unissent nous é… https://t.co/aDV2uKnlxg
1342145106028228610,2020-12-24 16:28:23,"Je veux aussi exprimer ma profonde gratitude à tous les agents de l'État, à nos héros du quotidien, dans nos hôpita… https://t.co/x7oElfOv7r"
1342145104279166977,2020-12-24 16:28:23,Mes pensées accompagnent les Français qui seront seuls et pour qui cette soirée de réveillon va raviver l'isolement… https://t.co/mXtgbGq1u2
1342145102895075329,2020-12-24 16:28:23,"Ce soir, ils ne seront pas six à table."
1342137552912977920,2020-12-24 15:58:22,"RT @EmmanuelMacron: L’unité et la fermeté européennes ont payé. L’accord avec le Royaume-Uni est essentiel pour protéger nos citoyens, nos…"
1341830145087311872,2020-12-23 19:36:51,Au lendemain de mes échanges avec les représentants du cinéma et du spectacle vivant et alors que le Conseil d’État… https://t.co/r6o9bx0VD2
1341758555398033408,2020-12-23 14:52:22,"Une étape majeure pour la politique publique des données, des algorithmes et des codes sources.
Le rapport d'… https://t.co/jMNAbBBw0Z"
1341643215993188352,2020-12-23 07:14:03,"Trois de nos gendarmes ont été tués cette nuit, alors qu'ils étaient engagés pour protéger et sauver.
Ce drame nous… https://t.co/7qgMfpmvBt"
1341100898043506688,2020-12-21 19:19:05,"RT @vonderleyen: Merci @JeanCASTEX, les journées européennes de la vaccination seront un grand moment d’unité et d’espoir.

#EUvaccinationd…"
1341075778256195584,2020-12-21 17:39:16,"La vaccination débutera dans les 27 pays de l'UE les 27, 28 et 29 décembre.
À tous les sceptiques, à tous ceux qui… https://t.co/XKbsA0xkhF"
1340721388894740480,2020-12-20 18:11:03,"Ce délai de 2 jours permettra :
➖ d'assurer une coordination avec nos partenaires européens pour aboutir à une répo… https://t.co/yemeEcOL4t"
1340721386755674113,2020-12-20 18:11:02,Nous invitons l'ensemble des ressortissants français à réaliser un test PCR qui pourra être exigé pour toute entrée… https://t.co/KsFzfrQ58h
1340721381546323970,2020-12-20 18:11:01,"Compte tenu du risque sanitaire nouveau, et dans l'attente de son évaluation, l'ensemble des flux de personnes du R… https://t.co/1Nnu1MUsao"
1339987239011573764,2020-12-18 17:33:48,"C’est par un dialogue permanent avec nos élus locaux, et à l’écoute de chacun de nos territoires, que nous sommes p… https://t.co/U40rn1p3LI"
1339266869405036545,2020-12-16 17:51:18,"Transparence totale, vigilance absolue, détermination sans faille. https://t.co/HLRZx4cWWE"
1339260323698708487,2020-12-16 17:25:18,"À partir du mois de janvier, chaque personne malade se verra proposer, une visite à domicile par une équipe soignan… https://t.co/YCT6Lpp5Se"
1339256153692319744,2020-12-16 17:08:43,"RT @olivierveran: L’arrivée de vaccins moins d’un an après le déclenchement de la pandémie est un immense espoir, et une prouesse de la sci…"
1339240518946066434,2020-12-16 16:06:36,"La campagne débutera dans les tout prochains jours, dès que nous aurons eu la décision d’autorisation de mise sur l… https://t.co/4k86NXcpYW"
1339240516291014656,2020-12-16 16:06:35,"Notre campagne débutera, conformément à l'avis de la Haute Autorité de Santé, par les personnes les plus âgées accu… https://t.co/6dcdtiPlJ6"
1339240510393815041,2020-12-16 16:06:34,Nous préparons cette échéance depuis de longs mois : la première étape a été la sécurisation de nos approvisionneme… https://t.co/ziEMg1yhuv
1339234707985281025,2020-12-16 15:43:30,"Si l’ensemble des conditions sont réunies, les premières vaccinations pourraient être réalisées dès la dernière sem… https://t.co/QLwTnwnhCZ"
1339231988184707072,2020-12-16 15:32:42,RT @gouvernementFR: EN DIRECT | Le Premier ministre @JeanCastex s’exprime sur la stratégie vaccinale devant l’Assemblée nationale. https://…
1338775471857823744,2020-12-15 09:18:40,"La sécurité est prioritaire pour le président de la République comme pour le Gouvernement.
Notre devoir est d'assur… https://t.co/eAViNXXVlK"
1338766501004926978,2020-12-15 08:43:01,Ce n'est pas ma tendance naturelle d'entrer dans les foyers des gens et de leur dire ce qu'ils ont à faire. https://t.co/7ms4rNeuiu
1338759890509193219,2020-12-15 08:16:45,"La culture, c'est l'âme de notre pays.
Nous allons aider le secteur à surmonter à la crise, mais aussi préparer ens… https://t.co/rQScemrhwv"
1338754232242081793,2020-12-15 07:54:16,"Donner la parole au peuple, c'est la quintessence de la démocratie.
C'est un honneur pour le président de la Républ… https://t.co/aGy7vbUDwj"
1338555491438432257,2020-12-14 18:44:32,Le partenariat et la solidarité entre la France et la Tunisie ont montré toute leur importance et leur force face a… https://t.co/ac4bHDvUqB
1338542353267748865,2020-12-14 17:52:20,"Deux mois après notre rencontre à Bruxelles, j'ai reçu @ThierryBreton ce jour à Matignon pour un tour d'horizon des… https://t.co/ocyVJGNfad"
1338527132755095554,2020-12-14 16:51:51,Un grand aménagement public n'est jamais aussi réussi que lorsqu'il transforme la vie des gens et améliore leur quo… https://t.co/4MKyxfK7Ni
1338493968758304769,2020-12-14 14:40:04,RT @gouvernementFR: EN DIRECT | Inauguration de l’extension de la #ligne14 du métro de Paris par @JeanCastex https://t.co/QjedSUy2e0
1338471930987491331,2020-12-14 13:12:30,"Baptisée Meteor, elle deviendra pour tous ses usagers la #ligne14 : 22 ans après sa mise en service, j’inaugurerai… https://t.co/VTs0yNVSMx"
1338455577127755776,2020-12-14 12:07:31,"Moins de passoires thermiques, plus d'emplois !
Avec #FranceRelance, nous lançons 4214 chantiers de rénovation éner… https://t.co/4gwzmvE6U4"
1338450566842871809,2020-12-14 11:47:37,"RT @olivierdussopt: 🇫🇷🌱 Lancement ce matin avec @JeanCASTEX du plan #FranceRelance pour la rénovation des bâtiments de l’Etat.

➡️ 4.214 pr…"
1338440197927788547,2020-12-14 11:06:24,RT @gouvernementFR: EN DIRECT | Rénovation énergétique : l'État donne l'exemple avec 4214 projets retenus par #FranceRelance partout dans l…
1337805526512640001,2020-12-12 17:04:27,"Cet accord est emblématique de la déclinaison de #FranceRelance sur le territoire.
Il ouvre la voie à tous les dépa… https://t.co/YlJN9lw4JY"
1337794327825821696,2020-12-12 16:19:57,"Le meilleur antidote à la crise, c’est le retour de la croissance.
C'est l'objectif de #FranceRelance.
La résurgenc… https://t.co/ppVwWBiJq0"
1337784888330739713,2020-12-12 15:42:26,"RT @JFFountaine: À #LaRochelle, le Premier Ministre, @JeanCASTEX et la Ministre @j_gourault sont venus signer le plan de relance national.…"
1337781162337591296,2020-12-12 15:27:38,"RT @EmmanuelMacron: L'Accord de Paris a 5 ans.
Continuons. https://t.co/1qFpXsXj1B"
1337747007272873989,2020-12-12 13:11:55,"5 ans après l'adoption de l'accord de Paris, je crois plus que jamais à une écologie du concret, enracinée dans nos… https://t.co/gOY4E6gWt9"
1337721671105597450,2020-12-12 11:31:14,RT @gouvernementFR: EN DIRECT | État et départements unissent leurs forces pour la relance : @JeanCastex s'exprime depuis La Rochelle. http…
1337118172978290688,2020-12-10 19:33:09,RT @EmmanuelMacron: Le plan de relance européen historique décidé en juillet entre aujourd’hui dans le concret. Nous venons d’adopter un ac…
1337099223364472832,2020-12-10 18:17:51,Cette année 2020 aura été éprouvante pour nous tous. https://t.co/IkBv94VYkP
1337091791795974148,2020-12-10 17:48:19,"Je sais votre lassitude, vos doutes, vos souffrances.
Je les partage.
Mais je vous dois d’abord la vérité et la tra… https://t.co/8Tm9AxvHw4"
1337087173946994695,2020-12-10 17:29:58,"Si vous deviez retrouver au cours des prochaines semaines, pour les fêtes, une personne âgée ou vulnérable au coron… https://t.co/RpQsDODpIh"
1337084872939200522,2020-12-10 17:20:50,Pourquoi cet objectif de 5000 nouveaux cas par jour ? https://t.co/TUwiG3umF2
1337083340088815616,2020-12-10 17:14:44,"Le 15 décembre, comme nous l’avions annoncé, nous passerons à une nouvelle étape.
Mais ces règles seront plus stric… https://t.co/6WimEukXnE"
1337081067153608704,2020-12-10 17:05:42,"C'est en France que l’épidémie est aujourd’hui la mieux maîtrisée par rapport à nos voisins européens.
L'améliorati… https://t.co/T5dz6Nnwjy"
1337079873697951746,2020-12-10 17:00:58,RT @gouvernementFR: EN DIRECT | Point sur la situation sanitaire et les mesures destinées à lutter contre la #COVID19. https://t.co/UgUAF8X…
1336951731259928577,2020-12-10 08:31:46,"RT @LEXPRESS: C'est notre sujet de Une cette semaine : la génération #Covid_19, victime d'une crise sanitaire sans précédent. Comment évite…"
1336759952992591872,2020-12-09 19:49:43,https://t.co/DbNoLJQj6H
1336728898156032000,2020-12-09 17:46:19,"Pour mieux lutter contre le séparatisme, il nous fallait renforcer notre droit, avec le projet de loi présenté ce m… https://t.co/ABIVIqedvu"
1336681261197381634,2020-12-09 14:37:01,"Notre unique but est de permettre à ces grandes libertés publiques et individuelles, la liberté d’association, la l… https://t.co/4BBP2KDRpI"
1336666742790221826,2020-12-09 13:39:20,Ce projet de loi poursuit deux grands objectifs : garantir le respect des principes républicains et le libre exerci… https://t.co/2oN0gK2amP
1336649784493477889,2020-12-09 12:31:57,"Ce projet de loi n’est pas un texte contre les religions, ni contre la religion musulmane en particulier.
C’est à l… https://t.co/LSlkS8V2Jc"
1336647974194192386,2020-12-09 12:24:45,RT @Elysee: EN DIRECT | Présentation du projet de loi confortant le respect des principes républicains : suivez la conférence de presse du…
1336619489966895105,2020-12-09 10:31:34,"Je crois profondément à la laïcité, qui est une valeur moderne, protectrice et émancipatrice.
C’est la garantie que… https://t.co/CgmkqDGSuK"
1336603025218162690,2020-12-09 09:26:08,"RT @MuseeOrsay: En cette journée de deuil national, le musée d’Orsay accueillera les personnes souhaitant rendre hommage au Président Gisca…"
1336438232289042439,2020-12-08 22:31:19,"Ils ne portaient pas le même uniforme mais partageaient un même engagement : sauver des vies.
Leur disparition ende… https://t.co/Sksoh8L4me"
1336325206432907264,2020-12-08 15:02:11,"L'Égypte est un partenaire essentiel et stratégique pour notre pays.
La visite d'État du président @AlsisiOfficial… https://t.co/UbsJweBtJ4"
1336019255540805633,2020-12-07 18:46:27,"RT @olivierdussopt: 🏛✅ Face à la crise, et comme en 2020, nous doublons (à 1000€) en 2021 le plafond de la réduction d'impôt de 75% dite ""C…"
1335175725599559680,2020-12-05 10:54:34,"La France est belle quand elle est unie, solidaire et généreuse !
Faites un don pour le #Téléthon2020 :
☎️ 3637
💻… https://t.co/OqlVEd7VUC"
1334828083187224578,2020-12-04 11:53:09,"Élus, économistes, spécialistes des finances publiques : 10 personnalités vont proposer des scenarii de retour à l’… https://t.co/rlEiPhRE9z"
1334574765990948875,2020-12-03 19:06:34,"RT @EmmanuelMacron: Hommage au Président Valéry Giscard d’Estaing.
https://t.co/sXYBW3cYoG"
1334561561122398210,2020-12-03 18:14:05,"Sécurité, transparence, proximité. https://t.co/7Bcg1Ccei8"
1334556306070523906,2020-12-03 17:53:12,"Notre troisième objectif est de construire une logistique adaptée au défi majeur qui s'ouvre.
Acheminer des million… https://t.co/GlTgU0Yo2P"
1334553595090526213,2020-12-03 17:42:26,Notre deuxième objectif est de vacciner en priorité les personnes pour lesquelles le virus est la plus dangereux. C… https://t.co/ZusfjFJ9hE
1334551436949155840,2020-12-03 17:33:51,La vaccination sera gratuite pour tous.
1334550647862079491,2020-12-03 17:30:43,"Notre premier objectif a été de garantir que la France aura suffisamment de vaccins le moment venu.
→ La France dis… https://t.co/21C6kVVPek"
1334544549134348288,2020-12-03 17:06:29,La France est aujourd’hui le pays d’Europe où la baisse de la pression épidémique a été la plus forte et la plus ra… https://t.co/08NYg7sGXi
1334543753495896069,2020-12-03 17:03:20,RT @gouvernementFR: EN DIRECT | Présentation de la stratégie vaccinale du Gouvernement et des mesures de lutte contre la #COVID19 https://t…
1334534307810045954,2020-12-03 16:25:48,"L'arrivée de vaccins est une étape majeure dans notre combat contre la #COVID19.
Elle suscite aussi chez les França… https://t.co/LlDKThMJuB"
1334515479990439942,2020-12-03 15:10:59,"Avenir des pêcheurs, contrôles douaniers et sanitaires, sécurité de la frontière franco-britannique : quelle que so… https://t.co/zQyvEYdudd"
1334410359634096128,2020-12-03 08:13:16,"Valéry Giscard d'Estaing avait la France pour passion et l'Europe pour horizon.
Homme de progrès et de liberté, c'e… https://t.co/qhViTUKPxI"
1334410096986742785,2020-12-03 08:12:13,RT @EmmanuelMacron: https://t.co/YsnuhOiFn0
1334069658064982016,2020-12-02 09:39:26,Nous expérimenterons dans les prochaines semaines dans 3 territoires des campagnes de dépistage massif de la… https://t.co/bngx235BEm
1334057038566076417,2020-12-02 08:49:18,"Là où l'activité avait chuté de 30% au premier confinement, elle a diminué d'environ 10% sur ces dernières semaines… https://t.co/OlEY3H4axj"
1334054824762073091,2020-12-02 08:40:30,"L'épidémie a reculé.
Son rythme de régression nous place même, en Europe, dans les pays où la situation est la moin… https://t.co/V5emKytcPe"
1334051186459123712,2020-12-02 08:26:02,"Nos policiers et gendarmes nous protègent au péril de leur vie : quatre d'entre eux sont décédés, en service, depui… https://t.co/66I0OdSdAJ"
1334045667518537729,2020-12-02 08:04:07,Notre intention était claire : protéger nos forces de sécurité mais en aucun cas de porter atteinte à la liberté d'… https://t.co/RlGw0TnnVP
1333822249003081729,2020-12-01 17:16:20,"Longtemps taboue, parfois sous-estimée, la question du suicide chez les agriculteurs ne pouvait rester sans réponse… https://t.co/UKemKrHN09"
1333805207994707970,2020-12-01 16:08:37,Nous assumons totalement notre objectif de protéger les forces de sécurité intérieure mais nous entendons les inter… https://t.co/7OaLKD6r5q
1333803403806265345,2020-12-01 16:01:26,"La sécurité des Français est une priorité absolue.
Avec la proposition de loi d'@AliceThourot et Jean-Michel Fauver… https://t.co/KFnKzE2TCE"
1333489745792561155,2020-11-30 19:15:05,"RT @EmmanuelMacron: À tous les jeunes qui cherchent un emploi, une formation, un contrat d’apprentissage, un contrat de professionnalisatio…"
1333476108474396674,2020-11-30 18:20:53,"RT @NadiaHAI78: À Trappes aujourd’hui, ville de mes racines et de mon engagement, aux côtés de @JeanCASTEX et @Elisabeth_Borne pour visiter…"
1333472319889698816,2020-11-30 18:05:50,"RT @Elisabeth_Borne: Grâce au plan #1jeune1solution et à l'engagement des entreprises, 2020 sera la meilleure rentrée de l’histoire de l’ap…"
1333468986865045507,2020-11-30 17:52:35,"Le plan #1jeune1solution, les primes à l'embauche, ce n'est pas un « cadeau » fait aux entreprises : c'est permettr… https://t.co/QFJk4yplvQ"
1333455953639993350,2020-11-30 17:00:48,"Historique !
Comme Alexis et Dounia, recrutés par l'entreprise KONE, à Trappes, près de 400 000 jeunes auront signé… https://t.co/yc03eAiDu4"
1332699790329655298,2020-11-28 14:56:05,"10 millions de téléchargements : plus d'un Français sur six a déjà installé #TousAntiCovid !
C'est un maillon essen… https://t.co/3P6E6P6EpB"
1332686249820295174,2020-11-28 14:02:16,Je ne signe pas de mots d’absence...mais je continuerai à me battre pour que nos lycéens puissent poursuivre leur s… https://t.co/tlvZt0OBKq
1332671448419348480,2020-11-28 13:03:27,"Soulagement, bonheur de retrouver ses clients et de vivre de son activité à l’approche de Noël : ces mots sont reve… https://t.co/799DgZRMkE"
1332404672984911874,2020-11-27 19:23:23,RT @EmmanuelMacron: Les images que nous avons tous vues de l’agression de Michel Zecler sont inacceptables. Elles nous font honte. La Franc…
1332351561419337729,2020-11-27 15:52:20,"RT @MinSoliSante: #COVID19 | Comme annoncé par le Président de la République, aujourd'hui est versée l'aide exceptionnelle de solidarité pa…"
1332314585710419969,2020-11-27 13:25:25,"Accompagner, faciliter les démarches de chacun et finalement apporter à chaque problème une solution concrète, de l… https://t.co/XOpcErfBuh"
1332262701930848260,2020-11-27 09:59:15,"Lorsqu’on peine à boucler ses fins de mois, aux paroles, on préfère souvent les actes.
Conformément à l’engagement… https://t.co/73ZiRCzL94"
1331971435393413120,2020-11-26 14:41:51,"RT @Elysee: EN DIRECT | Hommage national à Daniel Cordier.
https://t.co/FqROhJSAGC"
1331933786205007872,2020-11-26 12:12:15,"Saisonniers, intermittents, travailleurs en « extra » alternant chômage et contrats courts dans des secteurs sinist… https://t.co/ye8fQKdpx9"
1331931744136802307,2020-11-26 12:04:08,Nous allons répondre à la situation des entreprises qui ne sont pas administrativement fermées mais dont l’activité… https://t.co/uA1JYoWgiG
1331922720376950784,2020-11-26 11:28:17,"Les bars et les restaurants resteront fermés, jusqu’au 20 janvier.
Il s’agit d’une décision extrêmement difficile à… https://t.co/oK1inmpuOp"
1331911992014229509,2020-11-26 10:45:39,Compte tenu de l’évolution positive de la situation sanitaire et des échanges fructueux qui ont eu lieu avec les pr… https://t.co/BoIbU1lf2Z
1331909587570749445,2020-11-26 10:36:06,Il est prématuré de parler de déconfinement. https://t.co/WNb6L0xQXS
1331903568849342464,2020-11-26 10:12:11,Nous devons avancer par étape et donner de la visibilité. Mais nous ne pourrons franchir chacune de ces étapes que… https://t.co/dcMdPdWPAb
1331902194384252929,2020-11-26 10:06:43,"Les mesures de freinage que nous avons prises ont permis de ralentir nettement la circulation du virus.
Alors que n… https://t.co/hSXOlyJw3g"
1331901514042933250,2020-11-26 10:04:01,RT @gouvernementFR: EN DIRECT | #COVID19 : conférence de presse sur la situation sanitaire et les mesures d'assouplissement du confinement.…
1331677142183272463,2020-11-25 19:12:26,Vous pouvez d'ores et déjà me poser vos questions et me faire part de vos interrogations sur mon compte Instagram.… https://t.co/hcB2zcfO8I
1331665822704693249,2020-11-25 18:27:27,#COVID19 | Je ferai le point demain matin sur la situation sanitaire et l'assouplissement des mesures de confinemen… https://t.co/AZ2BQK3pKi
1331587965798277121,2020-11-25 13:18:05,"RT @1ElisaMoreno: #NeRienLaisserPasser | En ce #25novembre, sur les 46 mesures issues du Grenelle des violences conjugales :

▶ 61% sont ef…"
1331526034110500866,2020-11-25 09:11:59,"RT @EmmanuelMacron: Mesdames, c’est à vous que je veux m’adresser aujourd’hui. https://t.co/t5dIGwG5MR"
1331493202050904065,2020-11-25 07:01:31,"#NeRienLaisserPasser | Vous êtes victime ou témoin de violences faites aux femmes ?

📞 En cas de danger, appelez le… https://t.co/KeLEIQngrv"
1331311843969814529,2020-11-24 19:00:52,RT @EmmanuelMacron: Adresse aux Français. https://t.co/KEZgRXbpZb
1331251838847475713,2020-11-24 15:02:26,"À l'issue du processus législatif qui permettra, j'en suis sûr, d'améliorer, de clarifier et d'enrichir la proposit… https://t.co/UaanFq4fMF"
1331249493027803143,2020-11-24 14:53:07,"Il n'a jamais été, il n'est pas, et il ne sera jamais dans les intentions du Gouvernement de porter atteinte, de qu… https://t.co/Oy8ieE0Ay5"
1331233919853801472,2020-11-24 13:51:14,"Bien sûr, nous travaillons au déploiement de vaccins, la communauté scientifique œuvre au développement de traiteme… https://t.co/0QzC5suKy5"
1331184507601481728,2020-11-24 10:34:53,"C'était il y a 35 ans, presque jour pour jour : le premier resto du cœur ouvrait à Lille.
Depuis sa création, un mi… https://t.co/7UxeSSed3Y"
1330963609350975489,2020-11-23 19:57:07,"J'échange ce soir avec les organisations syndicales et patronales de notre pays : nous abordons ensemble, en confia… https://t.co/tJK7po1iLg"
1330872706443730952,2020-11-23 13:55:54,RT @NadiaHAI78: A l’écoute des élus ce matin avec @JeanCastex pour rappeler notre mobilisation face à la crise et notre engagement à mobili…
1330855178304688128,2020-11-23 12:46:15,"RT @Elisabeth_Borne: Les quartiers prioritaires ne sont pas les oubliés de #FranceRelance. Dans tous les territoires, l'insertion par l'emp…"
1330852290656432131,2020-11-23 12:34:46,"L’égalité républicaine est au cœur des politiques menées par le Gouvernement. 
La crise sanitaire ne doit pas nous… https://t.co/OM9cghPdG2"
1330212744365215744,2020-11-21 18:13:27,"RT @olivierveran: Avec @JeanCastex aux côtés des soignants du @CHUDijon qui affrontent la deuxième vague et sauvent des vies. Pour eux, pou…"
1330190724609019914,2020-11-21 16:45:57,"Dijon est une des agglomérations les plus touchées par la #COVID19 : si la situation se stabilise, elle reste préoc… https://t.co/Yx93UMNXRk"
1330157061552939008,2020-11-21 14:32:11,RT @alaingriset: Avec @JeanCASTEX et @OlivierVeran à Dijon. Echanges avec les acteurs économiques et une délégation de #commerçants de Dijo…
1330128343929409543,2020-11-21 12:38:04,"À la librairie Grangier, à Dijon.
Ici, même si le retrait en magasin a permis de poursuivre partiellement l'activit… https://t.co/64XW3AHpEt"
1329889540425781250,2020-11-20 20:49:09,"RT @premaratlant: [#Rencontre] Aujourd'hui @JeanCASTEX, Premier ministre, rencontre les femmes et les hommes de l'action de l'État en mer.…"
1329865900544188422,2020-11-20 19:15:13,"Par mer calme, comme par gros temps, notre pays a besoin d’un cap.
Avec @RichardFerrand nous partageons la même bou… https://t.co/3zOlsUYjen"
1329853031505162241,2020-11-20 18:24:04,"Honneur, Patrie, Valeur, Discipline : c'est fidèles à cette devise que, chaque jour, les marins de la base d'aérona… https://t.co/FaxTydvHIa"
1329823941632942083,2020-11-20 16:28:29,"RT @EmmanuelMacron: Daniel Cordier, le résistant, le secrétaire de Jean Moulin, s’en est allé. Quand la France était en péril, lui et ses c…"
1329788531808428032,2020-11-20 14:07:46,"Les mesures de confinement commencent à produire leurs effets.
Ne relâchons pas nos efforts.
C’est l’indispensable… https://t.co/Sv9XScC52c"
1329767324883316738,2020-11-20 12:43:30,RT @RichardFerrand: Contact direct et discussions avec les commerçants et entrepreneurs à #Crozon. Petits commerçants et prestataires de se…
1329760389744222208,2020-11-20 12:15:57,"J’ai été maire.
Je ne peux imaginer nos centres-villes sans nos commerces de proximité et ceux qui les font vivre.… https://t.co/RI4f3j9XgP"
1329745409196101633,2020-11-20 11:16:25,RT @gouvernementFR: EN DIRECT | Le Premier ministre @JeanCastex s’exprime depuis Crozon https://t.co/upGWALOIlV
1329740456700293121,2020-11-20 10:56:44,"« Poursuivons nos efforts pour rouvrir le plus vite possible »
Catherine, propriétaire d’une librairie-papeterie à… https://t.co/Oo9u6Z74cZ"
1329728116848201728,2020-11-20 10:07:42,Vous faites la force de l’hôpital et du système de soins français. https://t.co/VTGZWIdNsj
1329722036000878592,2020-11-20 09:43:33,"Première étape de mon déplacement dans le Finistère au @CHRU_Brest.
Un symbole : celui de la solidarité nationale d… https://t.co/KOTOL7WR6h"
1329508532790693893,2020-11-19 19:35:09,"L’insertion des personnes en situation de handicap n’est pas une option, c’est un devoir et c'est une chance.
Ce me… https://t.co/DHKf9rnJ0Z"
1329444034495066115,2020-11-19 15:18:52,"RT @Travail_Gouv: #1jeune1solution | Découvrez la plateforme https://t.co/hGDmGVlBLZ 
✅Plus de 20.000 offres d'emploi et de formation
✅Des…"
1329325140505747456,2020-11-19 07:26:25,"Dans le cadre du #DuoDay, je partagerai aujourd'hui mon quotidien avec Thomas.
Avant de débuter cette journée, j'ai… https://t.co/PKvXImitDY"
1328996641349701633,2020-11-18 09:41:05,"Une économie en voie de décarbonation, une transition écologique plus puissante et une Nation plus résiliente face… https://t.co/g6DMXp0GFl"
1328404245654200322,2020-11-16 18:27:07,"Je sais les difficultés et les contraintes qui s'imposent aujourd'hui aux croyants.
Dans la concertation et le dial… https://t.co/Hasbgxmg6Q"
1328354077319835649,2020-11-16 15:07:46,"Un habitat digne et adapté, c'est le premier pas vers l'autonomie.
→ 45 millions € seront investis pour favoriser l… https://t.co/vzu90suqMi"
1328354071196143616,2020-11-16 15:07:44,Le taux de chômage est 2 fois plus élevé pour les personnes en situation de handicap : pour réduire ces inégalités… https://t.co/88huj1BBRQ
